product_name,original_data_column_1,original_data_column_2,supplier_article_number,ean,article_number,product_description,supplier,supplier_url,product_image_url,manufacturer,original_data_column_3
CLEAN and CLEVER PROFESSIONAL Chemikalienschutzhandschuhe Nitril PRO 57,persönliche-schutzausrüstung-(psa)/handschutz/chemikalienhandschutz/chemikalienhandschutz-mit-trägermaterial,Gr.XL,2134144,4024009028892,2134144,"Chemikalienschutzhandschuhe, sehr guter Schutz durch extra
langen Schaft, hautschonend, da frei von Latexproteinen,
anatomisch geformt, mit geradem Rand, hoher Tragekomfort,
da Innenseite mit Baumwolle beflockt, schweißabsorbierend,
gute Griffsicherheit durch strukturierte Außenseite,
Mehrweg-Handschuh für den Einsatz in der professionellen
Reinigung, zum Schutz beim Hantieren mit Chemikalien sowie
gewerblichen Arbeitsschutz, persönliche Schutzausrüstung
gemäß EN 420 sowie PSA-Verordnung (EU) 2016/425, Widerstand
gegen Bakterien und Pilze gemäß EN ISO 374-5:2016, kann bei
der Zubereitung und Behandlung von Lebensmitteln verwendet
werden, AQL-Wert gemäß EN374 1.5, Farbe grün, Größe XL,
Kategorie PSA Kategorie III - Irreversible Risiken, Länge
maximal 340 mm, Länge minimal 320 mm, Leistungslevel
Chemikalien und Mikroorganismen J K L O P T, Leistungslevel
Mechanische Risiken 4 1 0 1 X, Material Nitril,
Materialstärke 0,38 mm, Materialstärke Toleranz 0,05 mm,
Norm Chemikalien und Mikroorganismen EN 374 Typ A, Norm
Mechanische Risiken EN 388, 1 Paar, (Krt à 12 x 12 Paa).",igefa Handelsgesellschaft,https://store.igefa.de/p/clean-and-clever-pro-chemikalienschutzhandschuhe-nitril-pro-57-gr-xl/vLG7KHdZSoDamDZGfF7LVC,https://media.igefa.de/files/images_idealclean/2134144.jpg,CLEAN and CLEVER PROFESSIONAL,
CLEAN and CLEVER PROFESSIONAL Chemikalienschutzhandschuhe Latex PRO 59,persönliche-schutzausrüstung-(psa)/handschutz/chemikalienhandschutz/chemikalienhandschutz-mit-trägermaterial,Gr.M,2182902,4024009034084,2182902,"Chemikalienschutzhandschuhe, Spritz- und Chemikalienschutz,
mit wellenförmigen Rand, vollanatomische Passform, gute
Griffsicherheit durch strukturierte äußere Oberfläche,
gutes Tastgefühl, angenehmer Tragekomfort da Innenseite mit
Baumwolle beflockt, schweißabsorbierend, Mehrweg-Handschuhe
für den Einsatz in der professionellen Reinigung, zum
Schutz beim Hantieren mit Chemikalien sowie gewerblichen
Arbeitsschutz, persönliche Schutzausrüstung gemäß EN 420
sowie PSA-Verordnung (EU) 2016/425,
Permeationsbeständigkeit > 30 Minuten bei mind. 3
Prüfchemikalien, Widerstand gegen Bakterien und Pilze gemäß
EN ISO 374-5:2016, bestätigte Lebensmittelunbedenklichkeit
gemäß der Verordnung (EU) Nr. 1935/2004, AQL-Wert gemäß
EN374 1.5, Farbe blau, Größe M, Kategorie PSA Kategorie III",igefa Handelsgesellschaft,https://store.igefa.de/p/clean-and-clever-pro-chemikalienschutzhandschuhe-latex-pro-59-gr-m/fHcN5mJyxz4xWoxTAbPjzd,https://media.igefa.de/files/images_idealclean/2182902.jpg,CLEAN and CLEVER PROFESSIONAL,
CLEAN and CLEVER PROFESSIONAL Einmalschutzhandschuhe PRO 167,persönliche-schutzausrüstung-(psa)/handschutz/einweghandschuh/einweghandschuh-aus-nitril,Gr.S,2134077,4024009028335,3000006986,"Dieser Einmalschutzhandschuh kann durch seine sehr hohe Tastsensibilität und schwarze Farbe sowohl in der Gastronomie, in lebensmittelverkaufenden Branchen als auch in der Automobilindustrie eingesetzt werden. Durch den zuverlässigen Schutz vor
verdünnten chemischen Flüssigkeiten bietet er sich z. B. auch für den Friseur an.",igefa Handelsgesellschaft,https://store.igefa.de/p/clean-and-clever-pro-einmalschutzhandschuhe-pro-167-gr-s/FWD83MP5CF76fiSNx24d2i,https://media.igefa.de/files/images_idealclean/2134077.jpg,CLEAN and CLEVER PROFESSIONAL,öl- & fettbeständig; erhöhte Reißfestigkeit; hervorragende Passform; sehr hohe Tastsensibilität; latexfrei – empfohlen bei Latex-Allergien; gute Griffigkeit durch angerauhte Fingerkuppen
CLEAN and CLEVER PROFESSIONAL Einmalschutzhandschuhe PRO 167,persönliche-schutzausrüstung-(psa)/handschutz/einweghandschuh/einweghandschuh-aus-nitril,Gr.M,2134078,4024009028359,3000006987,"Dieser Einmalschutzhandschuh kann durch seine sehr hohe Tastsensibilität und schwarze Farbe sowohl in der Gastronomie, in lebensmittelverkaufenden Branchen als auch in der Automobilindustrie eingesetzt werden. Durch den zuverlässigen Schutz vor
verdünnten chemischen Flüssigkeiten bietet er sich z. B. auch für den Friseur an.",igefa Handelsgesellschaft,https://store.igefa.de/p/clean-and-clever-pro-einmalschutzhandschuhe-pro-167-gr-m/bBeV3XKc6ABRgSgdfAHmp5,https://media.igefa.de/files/images_idealclean/2134078.jpg,CLEAN and CLEVER PROFESSIONAL,öl- & fettbeständig; erhöhte Reißfestigkeit; hervorragende Passform; sehr hohe Tastsensibilität; latexfrei – empfohlen bei Latex-Allergien; gute Griffigkeit durch angerauhte Fingerkuppen
Kolibri GREEN Untersuchungshandschuhe,persönliche-schutzausrüstung-(psa)/handschutz/untersuchungshandschuh-und--fingerling/untersuchungshandschuh-unsteril-vinyl-puderfrei,Gr.M,2168402,4024009010934,3000011662,"Dieser nachhaltige Untersuchungshandschuh kann in zahlreichen Anwendungen sowohl im Alten- und Pflegeheim, in der Arzt- und Dentalpraxis als auch bei der mobilen Pflege eingesetzt werden. Durch den zuverlässigen Schutz vor Viren, Pilzen und
Bakterien bietet er sich auch im infektiösen Umfeld an. Dieser Handschuh ist Beschleuniger-frei und wurde mit 10 % weniger Wasser und 15 % weniger Co2, chlorfrei produziert.",igefa Handelsgesellschaft,https://store.igefa.de/p/kolibri-green-untersuchungshandschuhe-gr-m/NBNXuGjDmdRzdyjEmXvX9U,https://media.igefa.de/files/images_idealclean/2168402.jpg,Kolibri,öl- & fettbeständig; virenbeständig gemäß EN ISO 374-5; Desinfektionsmittel- & Zytostatika-beständig; sehr hohe Tastsensibilität & hervorragende Passform; ohne Naturlatex-Proteine (geeignet für Latexallergiker); Handschuhbox besteht zu 80 % aus recycletem Papier; beständig als Spritzschutz gegen viele verdünnte Chemikalien
Kolibri GREEN Untersuchungshandschuhe,persönliche-schutzausrüstung-(psa)/handschutz/untersuchungshandschuh-und--fingerling/untersuchungshandschuh-unsteril-vinyl-puderfrei,Gr.L,2168403,4024009010958,3000011663,"Dieser nachhaltige Untersuchungshandschuh kann in zahlreichen Anwendungen sowohl im Alten- und Pflegeheim, in der Arzt- und Dentalpraxis als auch bei der mobilen Pflege eingesetzt werden. Durch den zuverlässigen Schutz vor Viren, Pilzen und
Bakterien bietet er sich auch im infektiösen Umfeld an. Dieser Handschuh ist Beschleuniger-frei und wurde mit 10 % weniger Wasser und 15 % weniger Co2, chlorfrei produziert.",igefa Handelsgesellschaft,https://store.igefa.de/p/kolibri-green-untersuchungshandschuhe-gr-l-untersuchungshandschuhe-und-einmalhandschuhe-aus-nitril-puderfrei/tSQ5PiZDo6WRusmYJwVZ9Z,https://media.igefa.de/files/images_idealclean/2168403.jpg,Kolibri,öl- & fettbeständig; virenbeständig gemäß EN ISO 374-5; Desinfektionsmittel- & Zytostatika-beständig; sehr hohe Tastsensibilität & hervorragende Passform; ohne Naturlatex-Proteine (geeignet für Latexallergiker); Handschuhbox besteht zu 80 % aus recycletem Papier; beständig als Spritzschutz gegen viele verdünnte Chemikalien
Kolibri GREEN Untersuchungshandschuhe,persönliche-schutzausrüstung-(psa)/handschutz/untersuchungshandschuh-und--fingerling/untersuchungshandschuh-unsteril-vinyl-puderfrei,Gr.XL,2168404,4024009012112,3000011664,"Dieser nachhaltige Untersuchungshandschuh kann in zahlreichen Anwendungen sowohl im Alten- und Pflegeheim, in der Arzt- und Dentalpraxis als auch bei der mobilen Pflege eingesetzt werden. Durch den zuverlässigen Schutz vor Viren, Pilzen und
Bakterien bietet er sich auch im infektiösen Umfeld an. Dieser Handschuh ist Beschleuniger-frei und wurde mit 10 % weniger Wasser und 15 % weniger Co2, chlorfrei produziert.",igefa Handelsgesellschaft,https://store.igefa.de/p/kolibri-green-untersuchungshandschuhe-gr-xl-untersuchungshandschuhe-und-einmalhandschuhe-aus-nitril-puderfrei/dK7KD5PFw4pszH85V4cnLh,https://media.igefa.de/files/images_idealclean/2168404.jpg,Kolibri,öl- & fettbeständig; virenbeständig gemäß EN ISO 374-5; Desinfektionsmittel- & Zytostatika-beständig; sehr hohe Tastsensibilität & hervorragende Passform; ohne Naturlatex-Proteine (geeignet für Latexallergiker); Handschuhbox besteht zu 80 % aus recycletem Papier; beständig als Spritzschutz gegen viele verdünnte Chemikalien
Kolibri GREEN Untersuchungshandschuhe,persönliche-schutzausrüstung-(psa)/handschutz/untersuchungshandschuh-und--fingerling/untersuchungshandschuh-unsteril-vinyl-puderfrei,Gr.S,2168401,4024009009921,3000011661,"Dieser nachhaltige Untersuchungshandschuh kann in zahlreichen Anwendungen sowohl im Alten- und Pflegeheim, in der Arzt- und Dentalpraxis als auch bei der mobilen Pflege eingesetzt werden. Durch den zuverlässigen Schutz vor Viren, Pilzen und
Bakterien bietet er sich auch im infektiösen Umfeld an. Dieser Handschuh ist Beschleuniger-frei und wurde mit 10 % weniger Wasser und 15 % weniger Co2, chlorfrei produziert.",igefa Handelsgesellschaft,https://store.igefa.de/p/kolibri-green-untersuchungshandschuhe-gr-s-untersuchungshandschuhe-und-einmalhandschuhe-aus-nitril-puderfrei/v7WqRnv4fLD7C3aYQn3kDo,https://media.igefa.de/files/images_idealclean/2168401.jpg,Kolibri,öl- & fettbeständig; virenbeständig gemäß EN ISO 374-5; Desinfektionsmittel- & Zytostatika-beständig; sehr hohe Tastsensibilität & hervorragende Passform; ohne Naturlatex-Proteine (geeignet für Latexallergiker); Handschuhbox besteht zu 80 % aus recycletem Papier; beständig als Spritzschutz gegen viele verdünnte Chemikalien
Vileda Universal - Der Vielseitige,persönliche-schutzausrüstung-(psa)/handschutz/chemikalienhandschutz/chemikalienhandschutz-ohne-trägermaterial,Gr.M,1914931,4023103072442,100801/100223,"Mehrweghandschuh, hervorragende Fingersensibilität und
uneingeschränktes Tastgefühl, frei von Latexallergenen
geeignet für Latexallergiker, Innenbeflockung aus reiner
Baumwolle garantiert höchsten Tragekomfort, Bessere
Chemikalienbeständigkeit bis zu 4-mal länger haltbar als
Handschuhe aus Naturlatex, hohes Tastempfinden, geeignet
zum Einsatz im Reinigungssektor, Labor und Gastrobereich,
auch geeignet für Lebensmittelkontakt daher auch beständig
gegen pflanzliche Öle und Fette die Naturlatex angreifen,
durch seine Beständigkeit gegen viele Chemikalien, Öle und
Lösungsmittel ist er vielseitig einsetzbar, Farbe grün,
Größe M, Kategorie PSA Kategorie III - Irreversible Risiken,
Länge 320 mm, Leistungslevel Chemikalien und
Mikroorganismen K O S, Leistungslevel Mechanische Risiken 2
0 0 1 X, Material Nitrilkautschuk, Materialstärke 0,32 mm,
Norm Chemikalien und Mikroorganismen EN 374 Typ B, Norm
Mechanische Risiken EN 388, 1 Paar, (Krt à 50 Paa).",igefa Handelsgesellschaft,https://store.igefa.de/p/vileda-universal-der-vielseitige-gr-m/xjWpHG5LSumcWQP4NNqwFK,https://media.igefa.de/files/images_idealclean/1914931.jpg,Vileda,
Vileda Universal - Der Vielseitige,persönliche-schutzausrüstung-(psa)/handschutz/chemikalienhandschutz/chemikalienhandschutz-ohne-trägermaterial,Gr.L,1914941,4023103072459,100802/100224,"Mehrweghandschuh, hervorragende Fingersensibilität und
uneingeschränktes Tastgefühl, frei von Latexallergenen
geeignet für Latexallergiker, Innenbeflockung aus reiner
Baumwolle garantiert höchsten Tragekomfort, Bessere
Chemikalienbeständigkeit bis zu 4-mal länger haltbar als
Handschuhe aus Naturlatex, hohes Tastempfinden, geeignet
zum Einsatz im Reinigungssektor, Labor und Gastrobereich,
auch geeignet für Lebensmittelkontakt daher auch beständig
gegen pflanzliche Öle und Fette die Naturlatex angreifen,
durch seine Beständigkeit gegen viele Chemikalien, Öle und
Lösungsmittel ist er vielseitig einsetzbar, Farbe grün,
Größe L, Kategorie PSA Kategorie III - Irreversible Risiken,
Länge 320 mm, Leistungslevel Chemikalien und
Mikroorganismen K O S, Leistungslevel Mechanische Risiken 2
0 0 1 X, Material Nitrilkautschuk, Materialstärke 0,32 mm,
Norm Chemikalien und Mikroorganismen EN 374 Typ B, Norm
Mechanische Risiken EN 388, 1 Paar, (Krt à 50 Paa).",igefa Handelsgesellschaft,https://store.igefa.de/p/vileda-universal-der-vielseitige-gr-l/QcjEdvzpG8rqrQxeuadh9M,https://media.igefa.de/files/images_idealclean/1914941.jpg,Vileda,
Vileda Multipurpose - Der Feine,persönliche-schutzausrüstung-(psa)/handschutz/chemikalienhandschutz/chemikalienhandschutz-ohne-trägermaterial,Rot Gr.M,1915421,4023103080058,100750/100153,"Mehrweghandschuh, erhältlich im Quattro 4-Farbsystem für
maximale Sicherheit in der Einhaltung von Hygienemaßnahmen,
ist bis zu 40 % dicker als andere Handschuhe dieser Art,
zusätzliche Wachsbehandlung der Außenseite für eine
verbesserte Griffigkeit, bis zu 5-mal höhere Beständigkeit
gegen fetthaltige Lebensmittel, pflanzliche Öle sowie
Reinigungsmittel, die Innenbeflockung aus reiner Baumwolle
sichert einen hohen Tragekomfort und erlaubt die
Reduzierung von Latexallergenen, mechanischer Schutz nach
EN 388 (ausreichend für alle gewöhnlichen
Reinigungsaufgaben), geringe Chemikalienbeständigkeit und
wasserdicht nach EN 37, Schutz vor Mikroorganismen nach EN
374, geeignet zum Einsatz im Reinigungssektor und
Gastrobereich, auch geeignet für Lebensmittelkontakt
(fettige Lebensmittel ausgenommen), Farbe rot, Größe M,
Kategorie PSA Kategorie III - Irreversible Risiken, Länge
305 mm, Leistungslevel Chemikalien und Mikroorganismen K L
P, Leistungslevel Mechanische Risiken 1 0 1 0 X,
Materialstärke 0,40 mm, Norm Chemikalien und
Mikroorganismen EN 374 Typ B, Norm Mechanische Risiken EN
388, 1 Paar, (Krt à 50 Paa).",igefa Handelsgesellschaft,https://store.igefa.de/p/vileda-multipurpose-der-feine-rot-gr-m/9nuGzgMvtsdRuGD5fZwxnA,https://media.igefa.de/files/images_idealclean/1915421.jpg,Vileda,
Kolibri PREMIUM Untersuchungshandschuhe,persönliche-schutzausrüstung-(psa)/handschutz/untersuchungshandschuh-und--fingerling/untersuchungshandschuh-unsteril-vinyl-puderfrei,Gr.XL,2134128,4024009008856,2134128,"Dieser Untersuchungshandschuh kann durch seine weiche Vinylqualität in zahlreichen Bereichen in der Arzt- und Dentalpraxis, im Alten- und Pflegeheim und in der mobilen Betreuung eingesetzt werden. Durch die Materialeigenschaften und die
wirtschaftliche Ausrichtung des Handschuhs bietet er sich besonders bei einfachsten Tätigkeiten in der pflegerischen Versorgung am Patienten und Bewohner an.
Produktvorteile im Überblick:",igefa Handelsgesellschaft,https://store.igefa.de/p/kolibri-premium-untersuchungshandschuhe-gr-xl/cw4vyzLbcFzo7AFrA6u8Xa,https://media.igefa.de/files/images_idealclean/2134128.jpg,Kolibri,puderfrei; weiche Vinylqualität; leicht an- & ausziehbar; günstige Alternative zu Latex- & Nitrilhandschuhe
Kolibri PREMIUM Untersuchungshandschuhe,persönliche-schutzausrüstung-(psa)/handschutz/untersuchungshandschuh-und--fingerling/untersuchungshandschuh-unsteril-vinyl-puderfrei,Gr.S,2134125,4024009008085,2134125,"Dieser Untersuchungshandschuh kann durch seine weiche Vinylqualität in zahlreichen Bereichen in der Arzt- und Dentalpraxis, im Alten- und Pflegeheim und in der mobilen Betreuung eingesetzt werden. Durch die Materialeigenschaften und die
wirtschaftliche Ausrichtung des Handschuhs bietet er sich besonders bei einfachsten Tätigkeiten in der pflegerischen Versorgung am Patienten und Bewohner an.",igefa Handelsgesellschaft,https://store.igefa.de/p/kolibri-premium-untersuchungshandschuhe-gr-s/J9BSbwc9hjwaPRvtoNiQMB,https://media.igefa.de/files/images_idealclean/2134125.jpg,Kolibri,puderfrei; weiche Vinylqualität; leicht an- & ausziehbar; günstige Alternative zu Latex- & Nitrilhandschuhe
Kolibri PREMIUM Untersuchungshandschuhe,persönliche-schutzausrüstung-(psa)/handschutz/untersuchungshandschuh-und--fingerling/untersuchungshandschuh-unsteril-vinyl-puderfrei,Gr.M,2134126,4024009008115,2134126,"Dieser Untersuchungshandschuh kann durch seine weiche Vinylqualität in zahlreichen Bereichen in der Arzt- und Dentalpraxis, im Alten- und Pflegeheim und in der mobilen Betreuung eingesetzt werden. Durch die Materialeigenschaften und die
wirtschaftliche Ausrichtung des Handschuhs bietet er sich besonders bei einfachsten Tätigkeiten in der pflegerischen Versorgung am Patienten und Bewohner an.
Produktvorteile im Überblick:",igefa Handelsgesellschaft,https://store.igefa.de/p/kolibri-premium-untersuchungshandschuhe-gr-m/vsZniv4RADQAWft3Xxidam,https://media.igefa.de/files/images_idealclean/2134126.jpg,Kolibri,puderfrei; weiche Vinylqualität; leicht an- & ausziehbar; günstige Alternative zu Latex- & Nitrilhandschuhe
Kolibri PREMIUM Untersuchungshandschuhe,persönliche-schutzausrüstung-(psa)/handschutz/untersuchungshandschuh-und--fingerling/untersuchungshandschuh-unsteril-vinyl-puderfrei,Gr.L,2134127,4024009008849,2134127,"Dieser Untersuchungshandschuh kann durch seine weiche Vinylqualität in zahlreichen Bereichen in der Arzt- und Dentalpraxis, im Alten- und Pflegeheim und in der mobilen Betreuung eingesetzt werden. Durch die Materialeigenschaften und die
wirtschaftliche Ausrichtung des Handschuhs bietet er sich besonders bei einfachsten Tätigkeiten in der pflegerischen Versorgung am Patienten und Bewohner an.
Produktvorteile im Überblick:",igefa Handelsgesellschaft,https://store.igefa.de/p/kolibri-premium-untersuchungshandschuhe-gr-l/CpxNMxkBtVPTQvM9SBnCqV,https://media.igefa.de/files/images_idealclean/2134127.jpg,Kolibri,puderfrei; weiche Vinylqualität; leicht an- & ausziehbar; günstige Alternative zu Latex- & Nitrilhandschuhe
Kolibri PREMIUM Untersuchungshandschuhe,persönliche-schutzausrüstung-(psa)/handschutz/untersuchungshandschuh-und--fingerling/untersuchungshandschuh-unsteril-latex-puderfrei,Gr.S,2134069,4024009031830,39-067-S,"Kolibri Premium Latex Untersuchungshandschuhe und Einmalschutzhandschuhe aus Naturlatex.
Die Premium Untersuchungshandschuhe sind als Spritzschutz viele Flüssigkeiten beständig.
Die Kolibri Nitril-Handschuhe besitzen eine hervorragende Reißfestigkeit und Passform.
Sie sind beidseitig verwendbar und besitzen eine gute Griffsicherheit durch angeraute Fingerkuppen.
Hinweis: Das Produkt enthält Naturlatex, welches allergische Reaktionen hervorrufen kann. Bei Unverträglichkeit gegen diesen Stoff nicht verwenden.
Produktvorteile im Überblick:",igefa Handelsgesellschaft,https://store.igefa.de/p/kolibri-premium-untersuchungshandschuhe-gr-s/ikDdSgWkf6XgFZpp56g2tP,https://media.igefa.de/files/images_idealclean/2134069.jpg,Kolibri,
Kolibri PREMIUM Untersuchungshandschuhe,persönliche-schutzausrüstung-(psa)/handschutz/untersuchungshandschuh-und--fingerling/untersuchungshandschuh-unsteril-latex-puderfrei,Gr.XL,2134072,4024009031861,39-067-XL,"Kolibri Premium Latex Untersuchungshandschuhe und Einmalschutzhandschuhe aus Naturlatex.
Die Premium Untersuchungshandschuhe sind als Spritzschutz viele Flüssigkeiten beständig.
Die Kolibri Nitril-Handschuhe besitzen eine hervorragende Reißfestigkeit und Passform.
Sie sind beidseitig verwendbar und besitzen eine gute Griffsicherheit durch angeraute Fingerkuppen.
Hinweis: Das Produkt enthält Naturlatex, welches allergische Reaktionen hervorrufen kann. Bei Unverträglichkeit gegen diesen Stoff nicht verwenden.
Produktvorteile im Überblick:",igefa Handelsgesellschaft,https://store.igefa.de/p/kolibri-premium-untersuchungshandschuhe-gr-xl/XgkJcdK3rUxYrnkUfi64Uk,https://media.igefa.de/files/images_idealclean/2134072.jpg,Kolibri,
Kolibri PREMIUM Untersuchungshandschuhe,persönliche-schutzausrüstung-(psa)/handschutz/untersuchungshandschuh-und--fingerling/untersuchungshandschuh-unsteril-latex-puderfrei,Gr.M,2134070,4024009031847,39-067-M,"Kolibri Premium Latex Untersuchungshandschuhe und Einmalschutzhandschuhe aus Naturlatex.
Die Premium Untersuchungshandschuhe sind als Spritzschutz viele Flüssigkeiten beständig.
Die Kolibri Nitril-Handschuhe besitzen eine hervorragende Reißfestigkeit und Passform.
Sie sind beidseitig verwendbar und besitzen eine gute Griffsicherheit durch angeraute Fingerkuppen.
Hinweis: Das Produkt enthält Naturlatex, welches allergische Reaktionen hervorrufen kann. Bei Unverträglichkeit gegen diesen Stoff nicht verwenden.
Produktvorteile im Überblick:",igefa Handelsgesellschaft,https://store.igefa.de/p/kolibri-premium-untersuchungshandschuhe-gr-m/5YGtb3pm3zVAVvpwDJbUqJ,https://media.igefa.de/files/images_idealclean/2134070.jpg,Kolibri,
Kolibri PREMIUM Untersuchungshandschuhe,persönliche-schutzausrüstung-(psa)/handschutz/untersuchungshandschuh-und--fingerling/untersuchungshandschuh-unsteril-latex-puderfrei,Gr.L,2134071,4024009031854,39-067-L,"Kolibri Premium Latex Untersuchungshandschuhe und Einmalschutzhandschuhe aus Naturlatex.
Die Premium Untersuchungshandschuhe sind als Spritzschutz viele Flüssigkeiten beständig.
Die Kolibri Nitril-Handschuhe besitzen eine hervorragende Reißfestigkeit und Passform.
Sie sind beidseitig verwendbar und besitzen eine gute Griffsicherheit durch angeraute Fingerkuppen.
Hinweis: Das Produkt enthält Naturlatex, welches allergische Reaktionen hervorrufen kann. Bei Unverträglichkeit gegen diesen Stoff nicht verwenden.
Produktvorteile im Überblick:",igefa Handelsgesellschaft,https://store.igefa.de/p/kolibri-premium-untersuchungshandschuhe-gr-l/P3a5dfAVPQHwTA5tKPEX95,https://media.igefa.de/files/images_idealclean/2134071.jpg,Kolibri,
SENSITIVE Untersuchungshandschuhe,persönliche-schutzausrüstung-(psa)/handschutz/untersuchungshandschuh-und--fingerling/untersuchungshandschuh-unsteril-nitril-puderfrei,Gr.S,2232400,4024009012839,2232400,"Untersuchungshandschuhe und Einmalschutzhandschuhe aus
Nitril, puderfrei, virenbeständig gemäß EN ISO 374-5,
beständig als Spritzschutz gegen viele verdünnte
Chemikalien, Desinfektionsmittel- und Zytostatika-beständig,
öl- und fettbeständig, sehr hohe Tastsensibilität und
hervorragende Passform, ohne Naturlatex-Proteine (geeignet
für Latexallergiker), für den einmaligen Gebrauch im
hygienischen und medizinischen Bereich, geeignet für
Lebensmittelkontakt, unsteril, puderfrei, fingertexturiert,
beidhändig passend, Rollrand, kann bei zahlreichen
pflegerischen Aufgaben im Alten- und Pflegeheim, im
Krankenhaus und in der mobilen Pflege eingesetzt werden,
durch den zuverlässigen Schutz vor Viren, Pilzen und
Bakterien bietet er sich auch im infektiösen Umfeld an, AQL-
Wert gemäß EN374 1,5, Farbe hellblau, Größe S, Kategorie
PSA Kategorie III - Irreversible Risiken, Länge 24 cm,
Leistungslevel Chemikalien und Mikroorganismen K P T,
Material Nitril, Norm Chemikalien und Mikroorganismen EN
374 Typ B, Norm Medizinische Einmalhandschuhe EN 455, 1 Box
à 100 Stk, (Krt à 10 Box).",igefa Handelsgesellschaft,https://store.igefa.de/p/sensitive-untersuchungshandschuhe-gr-s/nBbqi4MLUkziq54jpNZboQ,https://media.igefa.de/files/images_idealclean/2232400.jpg,Kolibri,
SENSITIVE Untersuchungshandschuhe,persönliche-schutzausrüstung-(psa)/handschutz/untersuchungshandschuh-und--fingerling/untersuchungshandschuh-unsteril-nitril-puderfrei,Gr.XL,2232403,4024009013201,2232403,"Untersuchungshandschuhe und Einmalschutzhandschuhe aus
Nitril, puderfrei, virenbeständig gemäß EN ISO 374-5,
beständig als Spritzschutz gegen viele verdünnte
Chemikalien, Desinfektionsmittel- und Zytostatika-beständig,
öl- und fettbeständig, sehr hohe Tastsensibilität und
hervorragende Passform, ohne Naturlatex-Proteine (geeignet
für Latexallergiker), für den einmaligen Gebrauch im
hygienischen und medizinischen Bereich, geeignet für
Lebensmittelkontakt, unsteril, puderfrei, fingertexturiert,
beidhändig passend, Rollrand, kann bei zahlreichen
pflegerischen Aufgaben im Alten- und Pflegeheim, im
Krankenhaus und in der mobilen Pflege eingesetzt werden,
durch den zuverlässigen Schutz vor Viren, Pilzen und
Bakterien bietet er sich auch im infektiösen Umfeld an, AQL-
Wert gemäß EN374 1,5, Farbe hellblau, Größe XL, Kategorie
PSA Kategorie III - Irreversible Risiken, Länge 24 cm,
Leistungslevel Chemikalien und Mikroorganismen K P T,
Material Nitril, Norm Chemikalien und Mikroorganismen EN
374 Typ B, Norm Medizinische Einmalhandschuhe EN 455, 1 Box
à 100 Stk, (Krt à 10 Box).",igefa Handelsgesellschaft,https://store.igefa.de/p/sensitive-untersuchungshandschuhe-gr-xl/qiwnuMqbR6TVdvzBbioCuE,https://media.igefa.de/files/images_idealclean/2232403.jpg,Kolibri,
"SENSITIVE Untersuchungshandschuhe, weiss",persönliche-schutzausrüstung-(psa)/handschutz/untersuchungshandschuh-und--fingerling/untersuchungshandschuh-unsteril-nitril-puderfrei,Gr.M,2232405,4024009013379,VG 2134118,"Untersuchungshandschuhe und Einmalschutzhandschuhe aus
Nitrilbutadienkautschuk (NBR), beständig als Spritzschutz
gegen Chemikalien, Reinigungsmittel und Flüssigkeiten,
Desinfektions- und Zytostatika-beständig, öl- und
fettbeständig, hervorragende Tastsensibilität und hoher
Tragekomfort, anschmiegsame Passform, gute Griffigkeit
durch angeraute Fingerkuppen, latexfrei, puderfrei,
unsteril, beidseitig verwendbar, thiuramfrei,
Medizinprodukt gemäß Richtlinie 93/42/EWG (CE Klasse I),
auch geprüft nach ASTM D 6319, Einmalschutzhandschuhe zur
persönlichen Schutzausrüstung gemäß PSA-Verordnung (EU)
2016/425 (CE Kategorie III), Lebensmittelunbedenklich gemäß
VO (EU) Nr. 1935/2004, Virenschutzprüfung gemäß ASTM F 1671,
Farbe weiß, Größe M, Länge 24 cm, 1 Box à 200 Stk, (Krt à
10 Box).",igefa Handelsgesellschaft,https://store.igefa.de/p/sensitive-untersuchungshandschuhe-weiss-gr-m/Dr7HEzCgHBTi74WTRwVpGV,https://media.igefa.de/files/images_idealclean/2232405.jpg,Kolibri,
