product_name,original_data_column_1,original_data_column_2,supplier_article_number,ean,article_number,product_description,supplier,supplier_url,product_image_url,manufacturer,original_data_column_3
Taski AERO 8,reinigungsmaschinen/sauger/trockensauger/trockensauger-mit-kabel,inklusive Zubehör,2148027,7615400223275,7524247,"Der hocheffiziente Staubsauger TASKI AERO 8 nutzt modernste Technologie und verfügt über einen leistungsstarken Motor. Dank der patentierten Flüstertechnologie arbeitet der Staubsauger extrem leise. Darüber hinaus wird der Austausch von Teilen
wie Kabel und Filter durch ein intelligentes Produktdesign erleichtert und kann vom Benutzer schnell und werkzeuglos ausgeführt werden.",igefa Handelsgesellschaft,https://store.igefa.de/p/taski-aero-8-inklusive-zubehoer/2gWonuCr5FnRuYF7b83ttm,https://media.igefa.de/files/images_idealclean/2148027.jpg,Diversey,ultra-leise TASKI Flüstertechnologie; kompaktes & robustes TASKI-Design; nachhaltiges Konzept mit hoher Effizienz; nach modernsten Methoden aus der Praxis entwickelt & getestet
AERO Turbodüse,reinigungsmaschinen/sauger/sauger-zubehör/sauger-zubehör,Taski Aero Turbodüse d=32mm für Teppichbodenbeläge,2149398,7615400223671,7524293,"für alle AERO 8 und AERO 15 - Modelle, Durchmesser 32 mm, 1 Stück.",igefa Handelsgesellschaft,https://store.igefa.de/p/aero-turboduese-taski-aero-turboduese-d-32mm-fuer-teppichbodenbelaege/DgCjcBtQi8zjq4H3dPtFZg,https://media.igefa.de/files/images_idealclean/2149398.jpg,Diversey,
Staubfilterbeutel (1.433),reinigungsmaschinen/sauger/sauger-zubehör-staubfilterbeutel/sauger-zubehör-staubfilterbeutel,S152 Numatic-System,2059210,4260037978291,1.433,"für Floordress Kesselsauger S 12 / S 142 / S 152, QP 152,
Numatic S12 (neue Version), S 22, doppellagig, ungebleicht,
1 Packung à 10 Stk, (Krt à 30 Pac).",igefa Handelsgesellschaft,https://store.igefa.de/p/staubfilterbeutel-1-433-s152-numatic-system/8aZYtnWjoAaSZXXogFtuuD,https://media.igefa.de/files/images_idealclean/2059210.jpg,Diverse Hersteller,
Staubfilterbeutel (1.086),reinigungsmaschinen/sauger/sauger-zubehör-staubfilterbeutel/sauger-zubehör-staubfilterbeutel,HVC 200/ James/ JVC 225/ NVM1C,2059167,4260037978086,1.086,"doppellagig, ungebleicht, mit Schmutzklappe, passend für
Numatic Henry, HVR 200-22, HVC 200, James, JVC 225, JVR 225,
NVH 180-2, NVM 200, NVM 225, NVM 1C, NV 250, NVP 180-2, NRV
200-22, NRV 200T-2, NVQ 200-22, Henry Xtra HVX 200-22, NQS
250B-22, SSV 250-22, AVQ 250, RSAV 130, RSB 140, RSV130,
RSV200 (Rucksacksauger), Nuvac Plus NNR 200-2, Nuvac NNH
180-2, VIPER Smartness DV-10, GVD 10, 1 Packung à 10 Stk,
(Krt à 30 Pac).",igefa Handelsgesellschaft,https://store.igefa.de/p/staubfilterbeutel-1-086-hvc-200-james-jvc-225-nvm1c/gurgJvtPJ5dX4gfT4Aj4kZ,https://media.igefa.de/files/images_idealclean/2059167.jpg,Diverse Hersteller,
Sebo Filtertüten,reinigungsmaschinen/sauger/sauger-zubehör-staubfilterbeutel/sauger-zubehör-staubfilterbeutel,für FM Swing 37,2056631,4012615702916,7029/5,"Zubehör für Dart1/ Dart 2/ Dart 3/ Dart4, Floormatic Swing
37, 1 Stück, (Krt à 140 Stk).",igefa Handelsgesellschaft,https://store.igefa.de/p/sebo-filtertueten-fuer-fm-swing-37/vujNPoJE84SEE6shFApcdE,https://media.igefa.de/files/images_idealclean/2056631.jpg,Diverse Hersteller,
Hochleistungsfilter NVM-1CH,reinigungsmaschinen/sauger/sauger-zubehör-staubfilterbeutel/sauger-zubehör-staubfilterbeutel,Numatic Staubfilterbeutel,2062103,,604615V,"Zubehör, mehrlagiger Vliesstaubbeutel mit HEPA
Microfilterschicht HEPA-FLO, Klassifizierung H10, für
Modelle der 180er / 200er / 225er / 250er Serie, für Henry
240 Plus Sauger, 1 Stück, (Krt à 8 x 10 Stk).",igefa Handelsgesellschaft,https://store.igefa.de/p/hochleistungsfilter-nvm-1ch-numatic-staubfilterbeutel/aSfNG3hEcC9DgtQAHsb6MZ,https://media.igefa.de/files/images_idealclean/2062103.jpg,Diverse Hersteller,
bluematic SD 43Duo,reinigungsmaschinen/scheuermaschinen/einscheibenmaschinen/einscheibenmaschinen,190/380U/min,2057108,4024009014079,790.013VDE BM,"leistungsstarke Duo-Speed-Einscheibenmaschine, für alle
Reinigungsaufgaben wie Grundreinigung, Nass-Scheuern,
Shampoonieren, Polieren, Spray-Cleanern geeignet, je nach
Anwendung zur Reinigung und Pflege von Hart- oder textilen
Bodenbelägen einsetzbar, besonders leicht und einfach zu
Handhaben, dezentral gelagerter Antriebsmotor garantiert
ruhiges Arbeiten mit geringem Kraftaufwand, durch
drehmomentstarken Riemenantrieb arbeitet die Maschine
deutlich leiser und ohne Vibrationen, mit Loslassen des
Bedienhebels automatische Motorabschaltung, stufenlose
Deichselverstellung ermöglicht ergonomisches Arbeiten, aus
robustem und stabilem Metallgehäuse, große beschichtete
Transporträder ermöglichen leichte und abriebarme
Arbeitsweise, hochstellbarer Haken für Kabelaufwicklung
ermöglicht bei erneutem Einsatz schnell und einfach das
Netzkabel komplett von der Deichsel abzunehmen, Abmessung
56 x 45 x 122 cm, Arbeitsbreite 43 cm, Bürstdrehzahl 190 /
380 U/min, Gewicht 39 kg, Kabellänge 12,5 m, Nennaufnahme
maximal 1500 W, Schalldruckpegel 65 dB(A), Schutzart IPX4,
Schutzklasse I, Unterfahrhöhe maximal 34 cm, Unterfahrhöhe
minimal 32 cm, 1 Stück.",igefa Handelsgesellschaft,https://store.igefa.de/p/bluematic-sd-43duo-190-380u-min/BpiAmGPXF3QFyCatC8JSzZ,https://media.igefa.de/files/images_idealclean/2057108.jpg,bluematic,
bluematic VC 20W/D,reinigungsmaschinen/sauger/nass--/-trockensauger-mit-kabel/nass--/-trockensauger-mit-kabel,bluematic VC 20W/D Naß-/Trockensauger 1100 W,2057106,4024009014048,021.013VDE BM,"leistungsstarker Staub- und Wassersauger - das perfekte
Einstiegsmodell für den professionellen, gewerblichen
Einsatz, für die schnelle und effiziente Nass- und
Trockenreinigung kleinerer bis mittelgroßer Flächen in
Werkstätten, Produktions- oder Verkaufsräumen, mit
zweistufigem Bypass-Motor für beste Absaugergebnisse,
Trockenflachfiltersystem, mechanischer Schwimmerabschaltung,
Filtersystem bzw. Schmutzbehälter leicht zugänglich,
ergonomischer Tragegriff mit Saugrohraufnahme für einfachen
und bequemen Transport, integrierte Kabelaufwicklung und
Aufbewahrung am Motorkopf, kompakte, kippsichere und
robuste Bauweise, 3 m Schlauch mit Handrohr, 2-teiliges
Chromstahlrohr, Schwimmereinsatz, komplett, Staubfilterkorb,
komplett, Staubfilterbeutel, 2lg. Wassersaugdüse, Kombi-
Bodendüse, Polsterdüse, Fugendüse, Abmessung 38 x 38 x 60
cm, Arbeitsbreite 37 cm, Gewicht 9,8 kg, Kabellänge 15 m,
Luftfördermenge maximal 53 l/s, Nennleistungsaufnahme 1100
W, Nutzinhalt 9 l, Schalldruckpegel 65 dB(A), Schutzart
IPX4, Schutzklasse II, Staubbeutelinhalt 10 l, Unterdruck
19 kPa, Wassersäule 1900 mm, 1 Stück.",igefa Handelsgesellschaft,https://store.igefa.de/p/bluematic-vc-20w-d-bluematic-vc-20w-d-nass-trockensauger-1100-w/2TCZ3fqhG8m3BtFnqLrUXS,https://media.igefa.de/files/images_idealclean/2057106.jpg,bluematic,
bluematic VC 30Aqua,reinigungsmaschinen/sauger/nass--/-trockensauger-mit-kabel/nass--/-trockensauger-mit-kabel,bluematic VC 30 Aqua Naßsauger Naßsauger 1050 W 1 Stück,2072711,4024009014055,014.013VDE BM,"leistungsstarker Wassersauger für den professionellen
Einsatz, mit zweistufigem Bypass-Motor für beste
Absaugergebnisse, mit Trockenflachfiltersystem und
mechanischer Schwimmerabschaltung, Schmutzbehälter ist
leicht zugänglich und leicht zu entleeren, ergonomischer
Tragegriff mit Saugrohraufnahme für einfachen und bequemen
Transport, integrierte Kabelaufwicklung und Aufbewahrung am
Motorkopf, kompakte, kippsichere und robuste Bauweise, 4 m
Schlauch, 2 Saugrohre mit Saugbogen aus Edelstahl,
Schwimmereinsatz, komplett, Wassersaugdüse, Abmessung 42 x
42 x 65 cm, Arbeitsbreite 37 cm, Gewicht 12,7 kg,
Kabellänge 15 m, Luftfördermenge maximal 53 l/s,
Nennleistungsaufnahme 1050 W, Nutzinhalt 24 l,
Schalldruckpegel 71 dB(A), Schutzart IPX4, Schutzklasse II,
Staubbeutelinhalt 16 l, Unterdruck 18,5 kPa, Wassersäule
1850 mm, 1 Stück.",igefa Handelsgesellschaft,https://store.igefa.de/p/bluematic-vc-30aqua-bluematic-vc-30-aqua-nasssauger-nasssauger-1050-w-1-stueck/gXLSTZpPPh2wrb2VEi8ZQ,https://media.igefa.de/files/images_idealclean/2072711.jpg,bluematic,
bluematic VC 36B ECO,reinigungsmaschinen/sauger/bürstsauger/bürstsauger-mit-kabel,Bluematic VC 36B ECO 875W,2142902,4024009014147,91080IG,"Der Bürststaubsauger ist aufgrund des integrierten HEPA Filters hervorragend zur schonenden und gründlichen Unterhaltsreinigung von Teppichböden u. a. aus textilen Hartfloren wie Nadelfilz und Kugelgarn geeignet. In einem Arbeitsgang bürstet, saugt
und richtet er den Flor wieder auf. Schnell und zuverlässig entfernt er hartnäckig haftende Schmutzpartikel wie Haare oder Fäden und sorgt für ein perfektes Reinigungsergebnis. Neu: mit moderner Elektroteppichbürste.",igefa Handelsgesellschaft,https://store.igefa.de/p/bluematic-vc-36b-eco-bluematic-vc-36b-eco-875w/fEwASXPQU2Bq2cqCpqaCk8,https://media.igefa.de/files/images_idealclean/2142902.jpg,bluematic,mit elektronischer Sicherung; vier Laufrollen erleichtern die Arbeit; werkzeugfreies Wechseln der Bürstenstreifen per Knopfdruck; mit praktischer Reinigungsklappe zur leichten Beseitigung eventueller Verstopfungen; 4-fach manuell höhenverstellbar zur optimalen Anpassung an die Florhöhe (Drehregler)
bluematic SD 43Mono,reinigungsmaschinen/scheuermaschinen/einscheibenmaschinen/einscheibenmaschinen,bluematic SD 43 Mono Einscheibenmaschine 1200W Einscheibenmaschine 1200 W,2072713,4024009014062,741.013VDE BM,"klassische und leistungsstarke Einscheibenmaschine, für
alle Standardreinigungsaufgaben wie Grundreinigung, Nass-
Scheuern, Shampoonieren geeignet, je nach Anwendung zur
Reinigung und Pflege von Hart- oder textilen Bodenbelägen
einsetzbar, besonders leicht und einfach zu Handhaben,
dezentral gelagerter Antriebsmotor garantiert ruhiges
Arbeiten mit geringem Kraftaufwand, durch drehmomentstarken
Riemenantrieb arbeitet die Maschine deutlich leiser und
ohne Vibrationen, mit Loslassen des Bedienhebels
automatische Motorabschaltung, stufenlose
Deichselverstellung ermöglicht ergonomisches Arbeiten, aus
robustem und stabilem Metallgehäuse, große beschichtete
Transporträder ermöglichen leichte und abriebarme
Arbeitsweise, hochstellbarer Haken für Kabelaufwicklung
ermöglicht bei erneutem Einsatz schnell und einfach das
Netzkabel komplett von der Deichsel abzunehmen, Abmessung
56 x 45 x 122 cm, Arbeitsbreite 43 cm, Bürstdrehzahl 180
U/min, Gewicht 31 kg, Kabellänge 12,5 m, Nennaufnahme
maximal 1200 W, Schalldruckpegel 58 dB(A), Schutzart IPX4,
Schutzklasse I, Unterfahrhöhe maximal 34 cm, Unterfahrhöhe
minimal 32 cm, 1 Stück.",igefa Handelsgesellschaft,https://store.igefa.de/p/bluematic-sd-43mono-bluematic-sd-43-mono-einscheibenmaschine-1200w-einscheibenmaschine-1200-w/3bHKFPPFqVE3x7ZrKdyzTe,https://media.igefa.de/files/images_idealclean/2072713.jpg,bluematic,
bluematic SPX11,reinigungsmaschinen/teppichreinigungsmaschinen/sprühextraktionsmaschinen/sprühextraktionsmaschinen,bluematic SPX 11 Sprühextraktionsgerät 1200W Turbine/40W Pumpe,2072712,4024009014093,043.013VDE BM,"handliches, kompaktes Sprühextraktionsgerät, zur Reinigung
textiler Oberflächen wie z. B. Teppichböden, Polstermöbel
oder Fahrzeug-Innenräume, leichte und kompakte Bauweise,
daher vor allem bei kleineren Grund- und
Unterhaltsreinigungen ideal, kräftige Saugturbine
hinterlässt sehr wenig Restfeuchte im behandelten Gewebe,
Oberfläche wird so schnell wieder begehbar, optional
erhältlicher Hartbodenaufsatz erlaubt auch die Reinigung
auf Stein- oder anderen Hartböden, 3 m Saug-Sprühschlauch,
2-teiliges Chromstahlrohr, Teppichadapter, transparent,
Abmessung 65 x 32,5 x 44 cm, Arbeitsbreite 23 cm, Druck bar
2,5 bar, Gewicht 14 kg, Kabellänge 10 m, Luftfördermenge
maximal 54 l/s, Nennaufnahme maximal 1000 W,
Schalldruckpegel 71,5 dB(A), Schutzart IPX4, Schutzklasse
II, Sprühmenge 1,6 l/min, Tankinhalt Frischwasser 10,5 l,
Tankinhalt Schmutzwasser 9 l, Unterdruck 22 kPa, 1 Stück.",igefa Handelsgesellschaft,https://store.igefa.de/p/bluematic-spx11-bluematic-spx-11-spruehextraktionsgeraet-1200w-turbine-40w-pumpe/q8oebwEL9fsowXDXvVJUUS,https://media.igefa.de/files/images_idealclean/2072712.jpg,bluematic,
Dust Nozzle RD,reinigungsmaschinen/sauger/sauger-zubehör/sauger-zubehör,Premium - metallverstärkt,2104351,7615400219001,7523260,"Staubsaugerdüse, Durchmesser 32 mm, Modell Premium -
metallverstärkt, 1 Stück.",igefa Handelsgesellschaft,https://store.igefa.de/p/dust-nozzle-rd-premium-metallverstaerkt/eDnxdxyMnEqsw82er4zHnU,https://media.igefa.de/files/images_idealclean/2104351.jpg,Diversey,
Aktivfaserwalze,reinigungsmaschinen/scheuersaugmaschinen/scheuer-/saugmaschine-zubehör/scheuer-/saugmaschine-zubehör,"Taski Aktivfaserwalze 33,5cm Microfaser für Swingo 150",2093480,7615400204540,7519049,"durch Einsatz von Microfasern wird weniger Wasser benötigt,
womit auch weniger Tankstopps erforderlich sind, für Taski
swingo 150, wurde speziell für die Reinigung von Stein und
Keramikfließen entwickelt - für perfekte
Reinigungsergebnisse, Fasern dringen direkt in die Tiefe
des Bodens ein und verhelfen somit zu exzellenten
Reinigungsergebnissen auf porösen Böden, Anwender kann
Walze ganz einfach ohne Werkzeug austauschen, lange haltbar",igefa Handelsgesellschaft,https://store.igefa.de/p/aktivfaserwalze-taski-aktivfaserwalze-33-5cm-microfaser-fuer-swingo-150/L3YtqqRC5ddPUe82QQ5bSQ,https://media.igefa.de/files/images_idealclean/2093480.jpg,Diversey,
AERO Ritzendüse lang,reinigungsmaschinen/sauger/sauger-zubehör/sauger-zubehör,für Taski Aero Vento Modelle,2168986,7615400223749,7524300,"Zubehör, für TASKI Aero Vento Modelle, Durchmesser 32 mm, 1
Stück.",igefa Handelsgesellschaft,https://store.igefa.de/p/aero-ritzenduese-lang-fuer-taski-aero-vento-modelle/4tyQYXJDqNsbWnarSfiDih,https://media.igefa.de/files/images_idealclean/2168986.jpg,Diversey,
Scheuerbürste Waschbeton,reinigungsmaschinen/scheuersaugmaschinen/scheuer-/saugmaschine-zubehör/scheuer-/saugmaschine-zubehör,Taski Scheuerbürste 43cm Waschbeton f. Swingo 1850/4000,2108295,7615400203574,7517860,"mit abgeschrägten Borsten, für Swingo 1850 / 4000,
Durchmesser 43 cm, 1 Stück.",igefa Handelsgesellschaft,https://store.igefa.de/p/scheuerbuerste-waschbeton-taski-scheuerbuerste-43cm-waschbeton-f-swingo-1850-4000/YdHPJztYJJpVS4j6zyjs3j,https://media.igefa.de/files/images_idealclean/2108295.jpg,Diversey,
Scheuerbürste Waschbeton,reinigungsmaschinen/scheuersaugmaschinen/scheuer-/saugmaschine-zubehör/scheuer-/saugmaschine-zubehör,33 cm,2061985,7615400202102,7515517,"Zubehör für Scheuersaugmaschine, Durchmesser 33 cm, 1 Stück.",igefa Handelsgesellschaft,https://store.igefa.de/p/scheuerbuerste-waschbeton-33-cm/gTVH5oD6SXC2bpHuSSHjRX,https://media.igefa.de/files/images_idealclean/2061985.jpg,Diversey,
Anschlußkabel Aero,reinigungsmaschinen/sauger/trockensauger/trockensauger-mit-kabel,"Taski Anschlußkabel Aero16,5m",2201222,7615400225309,7524465,"Anschlußkabel, für einen längeren Arbeitsradius mit den
TASKI AERO Staubsaugern, Länge 16,5 m, 1 Stück.",igefa Handelsgesellschaft,https://store.igefa.de/p/anschlusskabel-aero-taski-anschlusskabel-aero16-5m/HG4HwsU2xJzTtDJvmLKbmH,https://media.igefa.de/files/images_idealclean/2201222.jpg,Diversey,
Swingo 350 E,reinigungsmaschinen/scheuersaugmaschinen/scheuer-/saugmaschine-mitgänger/scheuer-/saugmaschine-mitgänger,Taski Swingo 350 E Scheuersaugmaschine,2088504,7615400204250,7518528,"kleine netzbetriebene Scheuersaugmaschine, sehr robust und
langlebig, für kleine und überstellte Flächen mit
Walzenbürste für die Tiefenreinigung, durch die niedrige
Unterfahrhöhe und den flexiblen Griff sind überstellte
Flächen gut erreichbar, einfache und sichere Anwendung bei
perfekten Reinigungs- und Trocknungsergebnissen, Abmessung
79 x 45 x 43 cm, Arbeitsbreite 38 cm, Bürstendruck maximal
22 kg, Flächenleistung 1.140 m²/h, Gewicht 46 kg,
Kabellänge 25 m, Saugdüsenbreite 55 cm, Schalldruckpegel <
70 dB(A), Tankinhalt Frischwasser 10 l, Tankinhalt
Schmutzwasser 10 l, 1 Stück.",igefa Handelsgesellschaft,https://store.igefa.de/p/swingo-350-e-taski-swingo-350-e-scheuersaugmaschine/PLsxYtY9puaiXcVxpNLAXe,https://media.igefa.de/files/images_idealclean/2088504.jpg,Diversey,
Swingo 150 E,reinigungsmaschinen/scheuersaugmaschinen/scheuer-/saugmaschine-mitgänger/scheuer-/saugmaschine-mitgänger,inkl. Walzenbürste/Lamellen,2066161,7615400202324,7516209,"kleine netzbetriebene Scheuersaugmaschine mit Walzenbürste,
einfache und ergonomische Anwendung, gründliche Reinigung
überstellter Flächen durch die geringe Höhe des Bürstkopfes,
perfekte Reinigung ohne Ausrutschgefahr, einfache Lagerung
und einfacher Transport durch die kompakte Größe, für
kleine und überstellte Flächen im Design eines Bürstsaugers,
inkl. Walzenbürste Standard und Lamellensatz, Abmessung 43
x 38 x 112 cm, Arbeitsbreite 33,5 cm, Bürstdrehzahl 1700
U/min, Flächenleistung 1.190 m²/h, Gewicht 10,7 kg,
Kabellänge 15 m, Nennaufnahme maximal 1100 W,
Saugdüsenbreite 35,5 cm, Schalldruckpegel 74 dB(A),
Schutzklasse II, Tankinhalt Frischwasser 2,6 l, Tankinhalt
Schmutzwasser 2,9 l, 1 Stück.",igefa Handelsgesellschaft,https://store.igefa.de/p/swingo-150-e-inkl-walzenbuerste-lamellen/dpuAB7ZQMfgjwav3BcRbyN,https://media.igefa.de/files/images_idealclean/2066161.jpg,Diversey,
Ultimaxx 1900 DD55 Perfomance BMS 25A EBU,reinigungsmaschinen/scheuersaugmaschinen/scheuer-/saugmaschine-mitgänger/scheuer-/saugmaschine-mitgänger,ohne Batterie,2245907,7615400229819,7525225,"Batteriebetriebene Scheuersaugmaschine für mittlere Flächen
bis große Flächen mit elektronischer Bürsteneinheit,
Bedienelemente sind selbsterklärend, exzellente
Reinigungsleistung und Ergonomie, servicefreundlich,
effizienter Wasser- und Chemikalienverbrauch,
ausgezeichnete Wasseraufnhame mit patentiertem Saugbalken,
höchste Luftqualität durch HEPA-Filter, Vernetzung und
Fernwartung, extrem leise im Betrieb, TWISTER-Funktion für
chemiefreie Reinigung, große Tankkapazität erhöht die
Arbeitsautonomie, Abmessung 120 x 60 x 112 cm,
Arbeitsbreite 55 cm, Arbeitsgeschwindigkeit 4,5 km/h,
Bürstdrehzahl 195 U/min, Bürstendruck maximal 40 kg,
Flächenleistung 1.856 m²/h, Schalldruckpegel 63 dB(A),
Tankinhalt Frischwasser 43 l, Tankinhalt Schmutzwasser 45 l,
1 Stück.",igefa Handelsgesellschaft,https://store.igefa.de/p/ultimaxx-1900-dd55-perfomance-bms-25a-ebu-ohne-batterie/CKjvXndASbaMUMpy2wTjNP,https://media.igefa.de/files/images_idealclean/2245907.jpg,Diversey,
Swingo 455 B Li50,reinigungsmaschinen/scheuersaugmaschinen/scheuer-/saugmaschine-mitgänger/scheuer-/saugmaschine-mitgänger,inkl. Batterie/Ladegerät,2225806,7615400226214,7524725,"kompakte und wendige Scheuersaugmaschine, Kurz- und
Zwischenladen beschädigen die Batterie nicht mehr, sondern
erhöhen Ihre Flexibilität bei der Verwendung der Maschine,
Batterie ist in ca. 2 Stunden geladen, anstatt 10 Stunden
bei Gel-Batterien, Li-Ion Batterien halten 2000-2500
Ladezyklen und halten somit bis zu 4 mal länger als Gel-
Batterien, für kleine und überstellte Flächen, mit Li-Ion
Batterie und externem Ladegerät, vielseitig einsetzbar
durch kompakte Abmessung und kleinen, ergonomischen Griff,
patentierte V-förmige Saugdüse und bewährtes Bürstensystem,
intuitive Anwendung und gelbe Wartungspunkte für eine
einfache und sichere Anwendung, Abmessung 110 x 48 x 92 cm,
Arbeitsbreite 43 cm, Bürstendruck maximal 32 kg,
Flächenleistung 1.290 m²/h, Gewicht 120 kg, Kabellänge 2,5
m, Saugdüsenbreite 69 cm, Tankinhalt Frischwasser 22 l,
Tankinhalt Schmutzwasser 25 l, 1 Stück.",igefa Handelsgesellschaft,https://store.igefa.de/p/swingo-455-b-li50-inkl-batterie-ladegeraet/tPkZZhFr2umXhFBfwtAJGn,https://media.igefa.de/files/images_idealclean/2225806.jpg,Diversey,
Ultimaxx 900 DD55 P BMS 13A,reinigungsmaschinen/scheuersaugmaschinen/scheuer-/saugmaschine-mitgänger/scheuer-/saugmaschine-mitgänger,Taski Ultimaxx 900 DD55 P BMS,2229061,7615400230075,7525251,"Antriebslose Scheuersaugmaschine, unschlagbare Kombination
aus Reinigungsleistung und schnellster Trocknung, leiser
Betrieb und saubere Abluft, intelligente Technologien für
einen sicheren und schnellen Start, effiziente Verwendung
von Reinigungsmitteln dank IntelliDose+, 55 cm
Doppelscheibenaggregat, 13 A internes Ladegerät,
unübertroffene Hygiene und Effizienz, ausgezeichnete
Wasseraufnhame mit patentiertem Saugbalken, höchste
Luftqualität durch HEPA-Filter, Vernetzung und Fernwartung,
extrem leise im Betrieb, Abmessung 120 x 60 x 111 cm,
Arbeitsbreite 55 cm, Arbeitsgeschwindigkeit 3 km/h,
Bürstdrehzahl 195 U/min, Bürstendruck maximal 33 kg,
Flächenleistung 1238 m²/h, Schalldruckpegel 60 dB(A),
Tankinhalt Frischwasser 20 l, Tankinhalt Schmutzwasser 22 l,
1 Stück.",igefa Handelsgesellschaft,https://store.igefa.de/p/ultimaxx-900-dd55-p-bms-13a-taski-ultimaxx-900-dd55-p-bms/82HG3UYGETAWiCKVCWRBne,https://media.igefa.de/files/images_idealclean/2229061.jpg,Diversey,
Ultimaxx 2900 DD55 Perfomance EBU 25A,reinigungsmaschinen/scheuersaugmaschinen/scheuer-/saugmaschine-mitgänger/scheuer-/saugmaschine-mitgänger,ohne Batterie,2230121,7615400228584,7525094,"Batteriebetriebene Scheuersaugmaschine für mittlere Flächen
bis große Flächen, Bedienelemente sind selbsterklärend,
exzellente Reinigungsleistung und Ergonomie,
servicefreundlich, effizienter Wasser- und
Chemikalienverbrauch, ausgezeichnete Wasseraufnhame mit
patentiertem Saugbalken, höchste Luftqualität durch HEPA-
Filter, Vernetzung und Fernwartung, extrem leise im Betrieb,
TWISTER-Funktion für chemiefreie Reinigung, große
Tankkapazität erhöht die Arbeitsautonomie, Abmessung 144 x
60 x 113 cm, Arbeitsbreite 55 cm, Arbeitsgeschwindigkeit 4,
5 km/h, Bürstdrehzahl 195 U/min, Bürstendruck maximal 40 kg,
Flächenleistung 1.856 m²/h, Schalldruckpegel 63 dB(A),
Tankinhalt Frischwasser 63 l, Tankinhalt Schmutzwasser 63 l,
1 Stück.",igefa Handelsgesellschaft,https://store.igefa.de/p/ultimaxx-2900-dd55-perfomance-ebu-25a-ohne-batterie/BpeSb4ccBrrmTVRTN5MsBi,https://media.igefa.de/files/images_idealclean/2230121.jpg,Diversey,
1900 DD55 Perfomance BMS 13A EBU,reinigungsmaschinen/scheuersaugmaschinen/scheuer-/saugmaschine-mitgänger/scheuer-/saugmaschine-mitgänger,ohne Batterie,2228991,7615400229734,7525217,"Batteriebetriebene Scheuersaugmaschine für mittlere Flächen
bis große Flächen mit elektronischer Bürsteneinheit,
Bedienelemente sind selbsterklärend, exzellente
Reinigungsleistung und Ergonomie, servicefreundlich,
effizienter Wasser- und Chemikalienverbrauch,
ausgezeichnete Wasseraufnhame mit patentiertem Saugbalken,
höchste Luftqualität durch HEPA-Filter, Vernetzung und
Fernwartung, extrem leise im Betrieb, TWISTER-Funktion für
chemiefreie Reinigung, große Tankkapazität erhöht die
Arbeitsautonomie, Abmessung 120 x 60 x 112 cm,
Arbeitsbreite 55 cm, Arbeitsgeschwindigkeit 4,5 km/h,
Bürstdrehzahl 195 U/min, Bürstendruck maximal 40 kg,
Flächenleistung 1.900 m²/h, Schalldruckpegel 63 dB(A),
Tankinhalt Frischwasser 43 l, Tankinhalt Schmutzwasser 45 l,
1 Stück.",igefa Handelsgesellschaft,https://store.igefa.de/p/1900-dd55-perfomance-bms-13a-ebu-ohne-batterie/cYJfkbLyXBaAePaFrTZrGm,https://media.igefa.de/files/images_idealclean/2228991.jpg,Diversey,
Ultimaxx 900 DD55 P BMS 13A,reinigungsmaschinen/scheuersaugmaschinen/scheuer-/saugmaschine-mitgänger/scheuer-/saugmaschine-mitgänger,Taski Ultimaxx 900 DD55 P BMS,2245921,7615400230112,7525255,"Antriebslose Scheuersaugmaschine, unschlagbare Kombination aus
Reinigungsleistung und schnellster Trocknung, leiser Betrieb und saubere
Abluft, intelligente Technologien für einen sicheren und schnellen Start,
effiziente Verwendung von Reinigungsmitteln dank IntelliDose+, 55 cm
Doppelscheibenaggregat, 13 A internes Ladegerät, unübertroffene Hygiene und
Effizienz, ausgezeichnete Wasseraufnhame mit patentiertem Saugbalken, höchste
Luftqualität durch HEPA-Filter, Vernetzung und Fernwartung, extrem leise im
Betrieb, Ultimaxx 900 DD55 P BMS, ohne Akku und Reinigungswerkzeug, nicht
einsatzbereit, notwendig Batterie Artikel 2172329 sowie Führungsteller mit Pad
oder Bürste, Abmessung 120 x 60 x 111 cm, Arbeitsbreite 55 cm,
Arbeitsgeschwindigkeit 3 km/h, Flächenleistung 1238 m²/h, Schalldruckpegel 60
dB(A), Bürstdrehzahl 195 U/min, Bürstendruck maximal 33 kg, Tankinhalt
Frischwasser 20 l, Tankinhalt Schmutzwasser 22 l, 1 Stück.",igefa Handelsgesellschaft,https://store.igefa.de/p/ultimaxx-900-dd55-p-bms-13a-taski-ultimaxx-900-dd55-p-bms/fKon6Vc7TVDdUSfdzwvwSP,https://media.igefa.de/files/images_idealclean/2245921.jpg,Diversey,
2900 DD65 Perfomance BMS 25A,reinigungsmaschinen/scheuersaugmaschinen/scheuer-/saugmaschine-mitgänger/scheuer-/saugmaschine-mitgänger,ohne Batterie und Zubehör,2242369,7615400228638,7525099,"Batteriebetriebene Scheuersaugmaschine mit Antrieb, Bedienelemente sind
selbsterklärend, exzellente Reinigungsleistung und Ergonomie,
servicefreundlich, effizienter Wasser- und Chemikalienverbrauch,
ausgezeichnete Wasseraufnhame mit patentiertem Saugbalken, höchste
Luftqualität durch HEPA-Filter, Vernetzung und Fernwartung, extrem leise im
Betrieb, TWISTER-Funktion für chemiefreie Reinigung, große Tankkapazität
erhöht die Arbeitsautonomie, Ultimaxx 2900 DD65 P BMS, ohne Akku und
Reinigungswerkzeug, nicht einsatzbereit, notwendig Batterie Artikel 2172329
sowie Führungsteller mit Pad oder Bürste, , Abmessung 149 x 70 x 113 cm,
Arbeitsbreite 65 cm, Arbeitsgeschwindigkeit 4,5 km/h, Flächenleistung 2.900
m²/h, Schalldruckpegel 63 dB(A), Bürstdrehzahl 195 U/min, Bürstendruck maximal
42 kg, Tankinhalt Frischwasser 63 l, Tankinhalt Schmutzwasser 63 l, 1 Stück.",igefa Handelsgesellschaft,https://store.igefa.de/p/2900-dd65-perfomance-bms-25a-ohne-batterie-und-zubehoer/PEYe4iEpxaCcfiaak2dtrH,https://media.igefa.de/files/images_idealclean/2242369.jpg,Diversey,
