product_name,original_data_column_1,original_data_column_2,supplier_article_number,ean,article_number,product_description,supplier,supplier_url,product_image_url,manufacturer,original_data_column_3
CLEAN and CLEVER PROFESSIONAL Pflegeschwamm PRO 61,reinigungshilfen/schwämme/pflegeschwämme/pflegeschwämme,Rot / weiß,2124002,4024009019944,151999,"hochwertiger Pflegeschwamm, aus langlebigem, elastischem
Schaumstoffmaterial mit offenem, weichem Vliespad ohne
Schleifmittel, einfach im Handling durch komfortable
Griffleiste, besonders hygienisch im praktischen 4-
Farbsystem, waschbar bis 60° C, zur schonenden Reinigung
und Pflege aller empfindlichen Oberflächen, universelle
Einsatzmöglichkeit durch das hochwertige,
schleifmittelfreie Vliesmaterial, Breite 7 cm, Farbe rot /
weiß, Länge 15 cm, 1 Packung à 6 Stk, (Krt à 18 Pac).",igefa Handelsgesellschaft,https://store.igefa.de/p/clean-and-clever-pro-pflegeschwamm-pro-61-rot-weiss/5wx9zxxmYfYRuE3maThDiQ,https://media.igefa.de/files/images_idealclean/2124002.jpg,CLEAN and CLEVER PROFESSIONAL,
"CLEAN and CLEVER PROFESSIONAL Profi-Schwammtuch, klein PRO 65",reinigungshilfen/reinigungstücher---mehrweg/spül--und-schwammtücher/spül--und-schwammtücher,18 cm x 20 cm grün,2137803,4024009027666,131-040-91,"geprüft auf Schadstoffe, Produktklasse 1 (für den Kontakt
mit Babyartikeln geeignet), extrem saugstark, scheuerfest,
langlebig, angenehm weich und dennoch griffig, fusselfrei,
aus umweltfreundlichem Material, da aus natürlich
nachwachsenden Rohstoffen und Holzzellulose aus
nachhaltigem Anbau, palmöl- und plastikfrei (auch keine
Verwendung von Nano- bzw. Mikroplastik), vegan, verrottbar
auf einem haushaltsüblichen Komposter bzw. in der Biotonne,
koch- und waschmaschinenfest bis zu 95 °C, universelles
Nasswischtuch für die effiziente Reinigung, bestens
geeignet für die verschiedensten Anwendungsbereiche in
Restaurants, Bars, Küchen und Sanitärräumen, Breite 18 cm,
Farbe grün, Länge 20 cm, Material 70 % Holzzellulose / 30 %
Baumwolle, Öko-Label OEKO-TEX® STANDARD 100, 1 Packung à 10
Stk, (Krt à 50 Pac).",igefa Handelsgesellschaft,https://store.igefa.de/p/clean-and-clever-pro-profi-schwammtuch-klein-pro-65-18-cm-x-20-cm-gruen/4F3RojQ9wWy6FPf3JWZJYa,https://media.igefa.de/files/images_idealclean/2137803.jpg,CLEAN and CLEVER PROFESSIONAL,
CLEAN and CLEVER PROFESSIONAL Pflegeschwamm PRO 61,reinigungshilfen/schwämme/pflegeschwämme/pflegeschwämme,Blau / weiß,2124001,4024009019920,151998,"hochwertiger Pflegeschwamm, aus langlebigem, elastischem
Schaumstoffmaterial mit offenem, weichem Vliespad ohne
Schleifmittel, einfach im Handling durch komfortable
Griffleiste, besonders hygienisch im praktischen 4-
Farbsystem, waschbar bis 60° C, zur schonenden Reinigung
und Pflege aller empfindlichen Oberflächen, universelle
Einsatzmöglichkeit durch das hochwertige,
schleifmittelfreie Vliesmaterial, Breite 7 cm, Farbe blau /
weiß, Länge 15 cm, 1 Packung à 6 Stk, (Krt à 18 Pac).",igefa Handelsgesellschaft,https://store.igefa.de/p/clean-and-clever-pro-pflegeschwamm-pro-61-blau-weiss/VVwbnFQoPjGcND3FDSg2bj,https://media.igefa.de/files/images_idealclean/2124001.jpg,CLEAN and CLEVER PROFESSIONAL,
CLEAN and CLEVER SMART Microfasertuch SMA 62,reinigungshilfen/reinigungstücher---mehrweg/microfasertücher/microfasertücher,Rot,2133819,,MW-017R,CLEAN and CLEVER SMART Microfasertuch SMA 62 ist besonders geeignet für die tägliche Unterhaltsreinigung glatter Oberflächen.,igefa Handelsgesellschaft,https://store.igefa.de/p/clean-and-clever-smartline-microfasertuch-sma-62-rot/asRnnCoGwTHQ7nMiJs8Jw7,https://media.igefa.de/files/images_idealclean/2133819.jpg,CLEAN and CLEVER SMART,lange haltbar; universell einsetzbar; strapazierfähig & saugstark; reinigt gründlich & streifenfrei; gutes Schmutzaufnahmevermögen durch feine Microfasern
"CLEAN and CLEVER PROFESSIONAL Profi-Schwammtuch, klein PRO 65",reinigungshilfen/reinigungstücher---mehrweg/spül--und-schwammtücher/spül--und-schwammtücher,18 cm x 20 cm blau,2137802,4024009027635,131-040-90,"geprüft auf Schadstoffe, Produktklasse 1 (für den Kontakt
mit Babyartikeln geeignet), extrem saugstark, scheuerfest,
langlebig, angenehm weich und dennoch griffig, fusselfrei,
aus umweltfreundlichem Material, da aus natürlich
nachwachsenden Rohstoffen und Holzzellulose aus
nachhaltigem Anbau, palmöl- und plastikfrei (auch keine
Verwendung von Nano- bzw. Mikroplastik), vegan, verrottbar
auf einem haushaltsüblichen Komposter bzw. in der Biotonne,
koch- und waschmaschinenfest bis zu 95 °C, universelles
Nasswischtuch für die effiziente Reinigung, bestens
geeignet für die verschiedensten Anwendungsbereiche in
Restaurants, Bars, Küchen und Sanitärräumen, Breite 18 cm,
Farbe blau, Länge 20 cm, Material 70 % Holzzellulose / 30 %
Baumwolle, Öko-Label OEKO-TEX® STANDARD 100, 1 Packung à 10
Stk, (Krt à 50 Pac).",igefa Handelsgesellschaft,https://store.igefa.de/p/clean-and-clever-pro-profi-schwammtuch-klein-pro-65-18-cm-x-20-cm-blau/gkuKJfChUb4fQvPdKmgis6,https://media.igefa.de/files/images_idealclean/2137802.jpg,CLEAN and CLEVER PROFESSIONAL,
CLEAN and CLEVER SMART Microfasertuch SMA 62,reinigungshilfen/reinigungstücher---mehrweg/microfasertücher/microfasertücher,Gelb,2133821,,MW-017Y,CLEAN and CLEVER SMART Microfasertuch SMA 62 ist besonders geeignet für die tägliche Unterhaltsreinigung glatter Oberflächen.,igefa Handelsgesellschaft,https://store.igefa.de/p/clean-and-clever-smartline-microfasertuch-sma-62-gelb/AUeCwstC7xdSYSBRJvEEGN,https://media.igefa.de/files/images_idealclean/2133821.jpg,CLEAN and CLEVER SMART,lange haltbar; universell einsetzbar; strapazierfähig & saugstark; reinigt gründlich & streifenfrei; gutes Schmutzaufnahmevermögen durch feine Microfasern
CLEAN and CLEVER SMART Microfasertuch SMA 62,reinigungshilfen/reinigungstücher---mehrweg/microfasertücher/microfasertücher,Grün,2133822,,MW-017G,,igefa Handelsgesellschaft,https://store.igefa.de/p/clean-and-clever-smartline-microfasertuch-sma-62-gruen/7gG9NR4kpB8Vgas3ek4MYi,https://media.igefa.de/files/images_idealclean/2133822.jpg,CLEAN and CLEVER SMART,lange haltbar; kochfest bis 95° C; reinigt gründlich & streifenfrei; gutes Schmutzaufnahmevermögen; Material - 85% Polyester / 15% Polyamid
Meiko Vlies-Scheuertuch Effekt fk 250,reinigungshilfen/reinigungstücher---mehrweg/bodenreinigungstücher/bodenreinigungstücher,60 cm,2158051,,SET00285,"Das Meiko Scheuertuch Effect reinigt mit dem Maß von 50 x 60 cm effektiv verschmutzte Böden. Mit dem Effect Scheuertuch werden Böden in Veranstaltungsräumen, Küchen und Industriebereichen effizient gereinigt. Das Bodentuch von Meiko hat einen hohen
Baumwoll- und Viskoseanteil und ist für die leistungsfähige Nass- und Feuchtreinigung konzipiert.",igefa Handelsgesellschaft,https://store.igefa.de/p/meiko-vlies-scheuertuch-effekt-fk-250-60-cm/5RkYVbBe4rHgQBdCPqZBa6,https://media.igefa.de/files/images/2158051.jpg,Diverse Hersteller,2-seitig gesäumt; Faservlies rohweiß; vielseitig einsetzbar; aus regenerierten Rohstoffen; für den alltäglichen Gebrauch; feste Kante an den Längsseiten
Tana Foamhead QUICK&EASY,reinigungshilfen/dosiersysteme/dosierflaschen/--pistolen/--pumpen/--hähne/dosierflaschen/--pistolen/--pumpen/--hähne,inkl. leere Wasserkartusche,2148213,4031278940695,0714069,"Schaumsprühkopf für Quick & Easy System, besitzt eine
Schaumausbringung, neue gesteigerte Qualität
(Belastbarkeit) des Sprühkopfes, Dosierung findet in der
Konzentratflasche statt, nicht kompatibel mit alten Quick &
Easy Produkten, Schaumsprühkopf, eine leere Wasserkartusche,
1 Stück.",igefa Handelsgesellschaft,https://store.igefa.de/p/tana-foamhead-quick-easy-inkl-leere-wasserkartusche/w4vRKUNAehvZmzPFSHR7qe,https://media.igefa.de/files/images_idealclean/2148213.jpg,Tana,
Tork Tork Extra Starke Reinigungstücher,reinigungshilfen/reinigungstücher---einweg/putz-/-wischtücher---einzeltücher/putz-/-wischtücher---einzeltücher,"Weiß 41,5",2209205,7322541183008,530179,"Premium perforiert, exelCLEAN® Technologie - für raschere
professionelle Reinigungsergebnisse, starke Struktur
ermöglicht eine ausgezeichnete Öl- und Wasseraufnahme, Tork
Easy Handling - ermöglicht ein leichteres Tragen, Öffnen
und Entsorgen der Verpackungen, silikonfreie Tücher, es
bleiben auf der Oberfläche keine Rückstände zurück, ISEGA-
Zertifikat, äußerst saugfähig, dick und strapazierfähig
sind, halten sie auch festem Reiben stand, ohne zu reißen,
für unterschiedlichste Reinigungsarbeiten gleich ob in
Industrie, Werkstatt, Küche oder Labor, passen in den Tork
Einzeltuchspender, der Nachfüllpackungen vor Schmutz
schützt und den Verbrauch dank Einzelblattentnahme deutlich
senkt, für W4 Einzeltuch System, Breite 35,5 cm, Farbe weiß,
1-lagig, Länge 41,5, 1 Karton à 4 x 105 Tu.",igefa Handelsgesellschaft,https://store.igefa.de/p/tork-tork-extra-starke-reinigungstuecher-weiss-41-5/N3EAUNKXqixxhwLzh3UqnM,https://media.igefa.de/files/images_idealclean/2209205.jpg,Tork,
Kimtech KIMTECH® WETTASK* DS Wischtuch,reinigungshilfen/reinigungstücher---einweg/putz-/-wischtücher---innenabrollung/putz-/-wischtücher---innenabrollung,ohne Spenderbox,2182783,05027375052651,7757,"trockene Wischtücher zur Tränkung mit Desinfektionsmitteln,
geben die Desinfektionslösung hervorragend ab, einwandfreie
Benetzung der zu desinfizierenden Fläche, zur schnellen und
unkomplizierten Desinfektion und Reinigung von Flächen und
Medizinprodukten, für den Gebrauch mit vorgetränkten
Wischtüchern konzipiert, das Kosteneinsparungen bei
Lösungsmitteln und Desinfektionsmitteln ermöglicht und die,
Sicherheit erhöht,da nichts verschüttet werden kann - ohne
Flüssigmischung, perfekt zur Infektionskontrolle in stark
frequentierten Umgebungen im Gesundheitswesen und
wirkungsvoll gegen Schimmel und Bakterien, große,
perforierte Wischtücher sind ideal für Bereiche, in denen
es vor allem auf Hygiene und Sicherheit ankommt,
kombinierbar mit einer Reihe mobiler oder wandmontierbarer
Spendersysteme für kontrollierten Verbrauch und
Abfallvermeidung, Breite 15,2 cm, Farbe weiß, Länge 30,4 cm,
1 Karton à 6 x 140 Tu.",igefa Handelsgesellschaft,https://store.igefa.de/p/kimtech-kimtech-wettask-ds-wischtuch-ohne-spenderbox/QmLoM7PGM4zmh4U7BJZgQD,https://media.igefa.de/files/images_idealclean/2182783.jpg,Kimberly-Clark,
Nölle Profi Brush Staubbiene Kugelkopf mit Teleskopstiel,reinigungshilfen/bürsten/staubwedel/staubwedel,"Staubbiene Staubwedel mit Teleskopstange, Kugelform, bunt bunt",3001685,4250560506702,281900,"Staubwedel, geschlitzte Kunstborste, staubbindend, komplett
mit Teleskopstange, Kugelform, Länge maximal 150 cm, 1
Stück, (Krt à 12 Stk).",igefa Handelsgesellschaft,https://store.igefa.de/p/noelle-profi-brush-staubbiene-kugelkopf-mit-teleskopstiel-staubbiene-staubwedel-mit-teleskopstange-kugelform-bunt-bunt/KJu3StpzjrDHdQSDEcj65i,https://media.igefa.de/files/images_idealclean/3001685.jpg,Nölle Profi-Brush,
Edelstahl-Putzspirale,reinigungshilfen/topfreiniger/-stahlwolle/reinigungskissen/-topfball/reinigungskissen/-topfball,40 g Gr.L,5000533,4024009027352,40g/L,"Entfernt schonend hartnäckige Verschmutzungen auf Edelstahl, Email und feuerfestem Geschirr.",igefa Handelsgesellschaft,https://store.igefa.de/p/edelstahl-putzspirale-40-g-gr-l/5cqmWBd7MoFKW2MGKRSyM4,https://media.igefa.de/files/images_idealclean/5000533.jpg,Diverse Hersteller,einzeln verpackt; rostfreie Edelstahlspirale; besonders haltbar & hygienisch
Nölle Profi Brush 2.0 Holz-Stiel,reinigungshilfen/besen-/-schrubberstiele/-gerätehalter/besen--und-schrubberstiele/besen--und-schrubberstiele,1350 mm,2148319,4250560518811,450324,Der BECOnnect 2.0 Besenstiel besitzt einen robusten Kopf mit praktischer Einhandverriegelung für einen schnellen Gerätewechsel und sicheren Halt.,igefa Handelsgesellschaft,https://store.igefa.de/p/noelle-profi-brush-2-0-holz-stiel-1350-mm/nN2UBWqep2iFC3kGpKiD2H,https://media.igefa.de/files/images_idealclean/2148319.jpg,Nölle Profi-Brush,"mit Klaue; sicherer Halt; Durchmesser Ø 23,5 mm; schneller Gerätewechsel; robuster Kopf mit praktischer Einhandverriegelung; ergonomische Stielkappe mit Aufhängeloch für komfortables Arbeiten"
Lysoform Soft-Vlies Rolle,reinigungshilfen/reinigungstücher---einweg/putz-/-wischtücher---innenabrollung/putz-/-wischtücher---innenabrollung,perforiert trocken,2117422,4105320034028,3402,"Flächenwischtücher - Trockenrolle, einzeln abreissbar, einfach in der
Handhabung, einzeln verpackt im transprenten Folienbeutel, reißfestes,
saugfähiges und fusselarmes Vlies, geeignet für alkoholische bzw. mit Wasser
verdünnte Flächendesinfektions- und / oder Reinigungsmittel, für nachfüllbares
Spendersystem - quadratischer Spender-Eimer mit transparenter Optik (igefa-Nr.
2117423), 1 Karton à 6 x 100 Tu.",igefa Handelsgesellschaft,https://store.igefa.de/p/lysoform-soft-vlies-rolle-perforiert-trocken/LqMVkegFgfLxyBhHRe8TJn,https://media.igefa.de/files/images_idealclean/2117422.jpg,Lysoform,
Dr. Schnell Desifor-one Wipes System Tücher,reinigungshilfen/reinigungstücher---einweg/putz-/-wischtücher---innenabrollung/putz-/-wischtücher---innenabrollung,Desifor-one Wipes Vliestücher,2125982,4008439019712,00556,"Zur Verwendung bei kompatiblen DR.SCHNELL Desinfektionsprodukten auf nicht-porösen Oberflächen mit mechanischer Einwirkung in Krankenhäusern, in medizinischen Einrichtungen in Schulen, Kindergärten und Heimen sowie in den Bereichen Lebensmittel,
Industrie, öffentliche Einrichtungen.",igefa Handelsgesellschaft,https://store.igefa.de/p/dr-schnell-desifor-one-wipes-system-tuecher-desifor-one-wipes-vliestuecher/AwXXiCuz9s3kVyaBpTmhjL,https://media.igefa.de/files/images_idealclean/2125982.jpg,Dr. Schnell,"Tuchrolle aus hochwertigen Vliestüchern; Folienbeutel zur Vermeidung von Kontamination; Einmaldeckel und Sicherheitsetikett zur Beschriftung; keine Aufbereitung des Feuchttuchspenders und Deckel erforderlich; stabiler Feuchttuchspender für 2,5 Liter Desinfektionsmittel-Tränklösung"
Nölle Profi Brush Spülbürste,reinigungshilfen/bürsten/spülbürsten/spülbürsten,Spülbürste rund PPN weiß Kunststoff mit Rundkopf weiß,1826831,4002625061264,313000,"weißer Besatz, Rundkopf mit Schaber, Besatzmaterial PPN,
Durchmesser 45 mm, Farbe weiß, 1 Stück, (Krt à 100 Stk).",igefa Handelsgesellschaft,https://store.igefa.de/p/noelle-profi-brush-spuelbuerste-spuelbuerste-rund-ppn-weiss-kunststoff-mit-rundkopf-weiss/CgFwpzCazK4PrTBbL7HzXd,https://media.igefa.de/files/images_idealclean/1826831.jpg,Nölle Profi-Brush,
Nölle Profi Brush Kehrschaufel lackiert 22 cm,reinigungshilfen/handfeger/-kehrschaufeln/-kehrgarnituren/kehrschaufeln/kehrschaufeln,(10),1828321,4250560507648,455500,"robuste Ausführung, mit Holzgriff, lackiert, Arbeitsbreite
22 cm, Farbe schwarz, Material Metall, 1 Stück, (Krt à 10
Stk).",igefa Handelsgesellschaft,https://store.igefa.de/p/noelle-profi-brush-kehrschaufel-lackiert-22-cm-10/qrHJB9Dh75zg7cDpFY78Xi,https://media.igefa.de/files/images_idealclean/1828321.jpg,Nölle Profi-Brush,
Nölle Profi Brush Spülbürste Kunststoff Rundkopf,reinigungshilfen/bürsten/spülbürsten/spülbürsten,Rundkopf d=45mm,1826851,4250560505422,1826851,"Die Spülbürste rund wird aus hochwertigen Materialien in der Farbe Weiß hergestellt. Der Besatz der Bürste besteht aus weißem PPN, während sich am Rundkopf zusätzlich ein Schaber befindet.",igefa Handelsgesellschaft,https://store.igefa.de/p/noelle-profi-brush-spuelbuerste-kunststoff-rundkopf-rundkopf-d-45mm/aa67ahPtuycakw35VMVg4L,https://media.igefa.de/files/images_idealclean/1826851.jpg,Nölle Profi-Brush,runder Spülbürstenkopf; Besatz aus weißem PPN; aus hochwertigen Materialien; zusätzlicher Schaber am Rundkopf
Tork Langlebige Reinigungstücher,reinigungshilfen/reinigungstücher---einweg/putz-/-wischtücher---außenabrollung/putz-/-wischtücher---außenabrollung,perforiert,2043564,7322540064827,90537,"reißfestes Vliesstofftuch, fusselarm, perforiert, weich,
hitzebeständig bis 360° C, ausgesprochen saugfähig und
besonders strapazierfähig, für unterschiedlichste
Reinigungsarbeiten geeignet, kann mehrfach verwendet werden
ohne die Form zu verlieren, ISEGA-Zertifikat, geeignet für
W1/W2/W3 System (Bodenständer/Wandhalter/Innenabrollung -
sowie Kartonhalterung-System), mit Reinigungsmitteln
einsetzbar, zertifiziert für Boeing, Airbus, EAC, SAE
International, Breite 32 cm, 1-lagig, Länge 38 cm, Länge
Gesamt 114 m, 1 Rolle à 300 Tu.",igefa Handelsgesellschaft,https://store.igefa.de/p/tork-langlebige-reinigungstuecher-perforiert/DeaemLatG6HpfJuU4epET4,https://media.igefa.de/files/images_idealclean/2043564.jpg,Tork,
